{
  "$schema": "https://json-schema.org/draft/2020-12/schema",
  "$id": "https://benchweave.dev/contracts/plugin-ui-class-reference/0.4.0/composed-action-class.schema.json",
  "title": "BenchWeave plugin-ui-class-reference composed action class 0.1.0",
  "description": "A vendor-authored action-class declaration: one versioned document that supplies the catalogue side of the derivation for action URNs no served catalog describes (layer 2 of the three-layer resolution, gateway #541 record section 3). The document claims action URNs explicitly (never a name-derivation guess), and the claims vocabulary is deliberately at least as permissive at the naming seam as the two layers it sits between: the OTDP descriptor puts no pattern on its action keys and layer 1's pinned vendor catalogs serve any key shape, so claims admits any versioned action key (owner ruling 2026-10-23) while class-action URNs in expect.controls stay otdp-namespaced, carries their input schema, and states one side effect from the closed set. It rides the descriptor's contracts[] pin seam (path plus sha256), plays the catalogue side of the D13 narrowing intersection unchanged, and never asserts presentation: the ladder still derives every control kind and reachability level. The document's own contract_version is the composed-action-class dialect version, deliberately decoupled from the family directory version so a pinned, digest-verified document stays valid across family bumps (the descriptor/otdp_version precedent); a dialect bump is a standards motion of its own.",
  "type": "object",
  "additionalProperties": false,
  "required": [
    "contract_version",
    "urn",
    "title",
    "claims",
    "input_schema",
    "side_effect"
  ],
  "properties": {
    "contract_version": {
      "const": "0.1.0"
    },
    "urn": {
      "$ref": "#/$defs/class_urn"
    },
    "title": {
      "$ref": "#/$defs/title"
    },
    "claims": {
      "type": "array",
      "minItems": 1,
      "maxItems": 64,
      "uniqueItems": true,
      "items": {
        "$ref": "#/$defs/claimed_action_urn"
      }
    },
    "input_schema": {
      "type": "object"
    },
    "side_effect": {
      "$ref": "#/$defs/side_effect"
    }
  },
  "$defs": {
    "class_urn": {
      "type": "string",
      "minLength": 1,
      "maxLength": 256,
      "pattern": "^otdp\\.action\\.[a-z_][a-z0-9_]*/[0-9]+\\.[0-9]+\\.[0-9]+$"
    },
    "title": {
      "type": "string",
      "minLength": 1,
      "maxLength": 256
    },
    "side_effect": {
      "enum": [
        "none",
        "state_change",
        "energy_removing"
      ]
    },
    "claimed_action_urn": {
      "type": "string",
      "minLength": 3,
      "maxLength": 256,
      "pattern": "^[A-Za-z0-9][A-Za-z0-9._:-]*/[0-9]+\\.[0-9]+\\.[0-9]+$"
    }
  }
}
